customerID,complaint,complaint_number
9565-DJPIB,"The streaming TV service frequently buffers or crashes, making it impossible for me to watch anything without interruptions. This has been ongoing despite my high monthly charges, and I am very frustrated with the lack of reliability.",1
4342-HFXWS,"The DSL internet service has been inconsistent lately, with frequent slowdowns during peak hours. This is making it difficult for my family to complete their tasks online.",1
4342-HFXWS,"The streaming TV service often buffers excessively, even though I have a stable internet connection. This ruins the experience for my family.",2
4342-HFXWS,"Despite having tech support included, it takes a long time to get in touch with a representative when I call for assistance.",3
4342-HFXWS,"The device protection plan I pay for did not cover a recent issue with my router, and I had to pay out of pocket for repairs.",4
4342-HFXWS,"I requested a paper bill for my records, but the bills are often delayed, making it hard to keep track of my payments.",5
8988-ECPJR,"The internet service has been very inconsistent, with frequent outages and slow speeds, making it difficult to complete important tasks. This has been an ongoing issue despite being a loyal customer for 34 months.",1
8988-ECPJR,I was disappointed to find out that there is no tech support available to help resolve my connectivity issues. It’s frustrating to pay for a premium service without proper assistance when problems arise.,2
8988-ECPJR,"The monthly charges are too high for the limited services provided, especially since I don’t even have Online Security or Device Protection. I feel like I’m not getting good value for my money.",3
1567-DSCIC,"The internet speed with your fiber optic service has been consistently poor, especially when I try to use Streaming TV. This is unacceptable for the high monthly charges I'm paying.",1
1567-DSCIC,"When I contacted customer support about the slow internet, I was told there was no issue on your end, but the problem still hasn't been resolved. This lack of assistance is incredibly frustrating.",2
7722-CVFXN,"The internet speed on my fiber optic connection has been inconsistent lately, especially during peak hours, which disrupts my streaming services and online activities. I expect better service considering the high monthly charges.",1
4686-GEFRM,"The streaming movies service frequently buffers or fails to load content, despite having a high-speed fiber optic connection. This has been a recurring issue and needs immediate attention.",1
5553-AOINX,"The streaming services I signed up for frequently buffer and have poor quality, even though I pay for high-speed fiber optic internet. This is incredibly frustrating, especially given the high monthly charges I am already paying.",1
9360-AHGNL,"The streaming services I signed up for frequently buffer or fail to load altogether, even though I’m paying for high-speed fiber optic internet.",1
9360-AHGNL,"Despite having tech support included in my plan, it took days to get a response when I reported my internet connection dropping multiple times a day.",2
9360-AHGNL,"The monthly charges for my services keep increasing, and I don’t feel I’m getting value for the amount I’m paying.",3
9360-AHGNL,"I’ve had to call multiple times to resolve billing discrepancies, but the issue keeps recurring, and it’s incredibly frustrating.",4
9103-TCIHJ,I’ve been experiencing frequent dropped calls and poor call quality despite having multiple lines. This has been very frustrating and is affecting my ability to stay connected.,1
9103-TCIHJ,"The DSL internet speed is far slower than what was promised when I signed up, making it difficult to complete online tasks efficiently.",2
9103-TCIHJ,"When I reached out to customer service about the slow internet and poor call quality, I was given no helpful resolution and felt my concerns were dismissed.",3
3874-EQOEP,"The streaming services I signed up for, including StreamingTV and StreamingMovies, frequently buffer or stop working altogether, making it impossible to enjoy any content.",1
3874-EQOEP,"I contacted customer support about the streaming issues, but I was put on hold for a long time and did not receive any meaningful assistance.",2
3874-EQOEP,"Despite the ongoing problems with the services, my monthly charges remain high, and there has been no adjustment or compensation for the inconvenience.",3
4078-SAYYN,"The streaming services I signed up for frequently buffer or crash, and the internet speed is inconsistent despite paying a high monthly fee. This has been very frustrating, especially since I'm on a month-to-month contract.",1
2968-SSGAA,The internet speed has been consistently poor despite paying for Fiber Optic service. Streaming movies and TV is a frustrating experience with constant buffering.,1
2968-SSGAA,"I contacted customer support about the slow internet, but I did not receive any helpful assistance, and the issue still persists.",2
2968-SSGAA,The monthly charges are excessively high for the quality of service provided. I don't feel I'm getting value for my money.,3
2968-SSGAA,"Despite not having Online Security or Tech Support, I feel the lack of these critical services greatly impacts my experience, and there was no clear communication about their absence when I signed up.",4
2968-SSGAA,"The billing process through electronic check has been inconvenient, and I noticed discrepancies in my bill that were not explained or corrected.",5
0529-ONKER,"The internet speed has been consistently slow, making it difficult to use even basic online services. This is unacceptable for the high monthly charges I'm paying.",1
0529-ONKER,"I have repeatedly called customer support about the internet issues, but I have not received any helpful resolution. The lack of assistance is frustrating.",2
0529-ONKER,The fact that I’m being charged $75.65 per month for services without additional features like online security or tech support feels unreasonable and overpriced.,3
0529-ONKER,"Despite opting for paper billing, I’ve noticed delays in receiving my bill, causing inconvenience and uncertainty about payment deadlines.",4
8390-FESFV,"The streaming services I've been paying for are constantly buffering and lagging, making it impossible to watch anything without interruptions. I've contacted customer support multiple times, but the issue still hasn't been resolved.",1
8519-IMDHU,"The streaming movies service often buffers and freezes, making it impossible to enjoy anything. Despite paying a high monthly charge, the quality of service has been extremely disappointing.",1
6648-INWPS,"I often experience billing delays due to the lack of paperless billing, and it’s inconvenient to manage payments with the current system. Please provide a more streamlined option.",1
6688-UZPWD,"The internet speed with the fiber optic service has been extremely inconsistent, especially while streaming TV and movies. Despite paying a high monthly charge, I am not getting the quality I expected, and there has been no resolution despite multiple attempts to contact support.",1
2858-MOFSQ,"The internet service has been unreliable for months, with frequent slowdowns and disconnections. Despite paying for DSL, the quality has not improved, and this has been extremely frustrating.",1
2858-MOFSQ,"I contacted customer support about the internet issues, but I did not receive any helpful assistance. The lack of tech support for resolving this problem was one of the main reasons I decided to leave.",2
2038-LLMLM,"The streaming services I pay for, both TV and movies, frequently lag or fail to load altogether. This has been an ongoing issue, especially during peak hours, and it's incredibly frustrating.",1
2038-LLMLM,"Despite having tech support included in my plan, I often have to wait an unreasonable amount of time to get assistance when I face technical issues. It's unacceptable for a service I’m paying a premium for.",2
2979-SXESE,"The streaming TV service frequently buffers and freezes, making it impossible to watch anything without interruptions. Despite having a fiber optic connection, the issue has not improved, and no resolution has been provided after multiple attempts to contact customer support.",1
1374-DMZUI,"The streaming services for both TV and movies often buffer or fail to load, which is extremely frustrating considering the high monthly charges I am paying.",1
1374-DMZUI,"I have been having issues with my fiber optic internet being down frequently, and there is no assistance available since my plan doesn't include tech support.",2
1374-DMZUI,"Your customer service is unhelpful when I try to resolve these issues, and I am tired of paying for services that do not work as advertised.",3
2189-UXTKY,"My monthly bill is too high for the services I’m receiving. Despite having tech support and online security, I’ve faced multiple issues with my internet service, including slow speeds and buffering while streaming. I expected better service for the price I’m paying.",1
4446-BZKHU,"The internet service has been consistently unreliable, with frequent outages and buffering issues while streaming TV and movies. Despite being a long-term customer, I feel that the quality of service has not improved, and this has been very frustrating.",1
8849-GYOKR,"I've been a loyal customer for years, but the high monthly charges for my services, especially for fiber optic internet and streaming, feel excessive compared to competitors. Despite having multiple services, I don't see any loyalty discounts or benefits.",1
0329-GTIAJ,"The streaming services I signed up for, both TV and movies, frequently buffer or stop working altogether. This has been incredibly frustrating, especially since I am paying for high-speed fiber optic internet.",1
0329-GTIAJ,"When I contacted tech support about the streaming issues, I was put on hold for an extended period, and the issue was not resolved even after multiple attempts.",2
9337-SRRNI,"The quality of the phone service has been poor lately, with frequent call drops and issues with clarity.",1
9337-SRRNI,"I feel like I'm being overcharged for my phone service, especially since I don't have internet services bundled with it.",2
9337-SRRNI,"I tried reaching out to customer support about my phone issues, but I haven't received any helpful response or resolution.",3
9451-WLYRI,"I've been a loyal customer for over four years, but I don't understand why my service options are so limited. Despite paying consistently, I'm not able to access internet services, which feels unfair. I would like an explanation or a way to upgrade my services.",1
2027-WKXMW,"The streaming services, both TV and movies, frequently buffer and ruin my viewing experience. This has been ongoing for weeks, and I expect better service given how much I’m paying monthly.",1
2027-WKXMW,"Despite having tech support included, it takes forever to get issues resolved when I call. The delays and lack of proactive solutions are extremely frustrating.",2
0122-OAHPZ,"The internet service has been extremely unreliable, with frequent outages and slow speeds, making it impossible to get work done or stream content. This has been an ongoing issue, and no resolution has been provided despite multiple attempts to reach out.",1
0122-OAHPZ,"The customer support team has been unhelpful in addressing my complaints about the internet service. Each time I call, I am either put on hold for an extended period or given generic responses without any real action being taken.",2
4489-SNOJF,"I am extremely disappointed with the frequent price increases on my monthly bill despite being a loyal customer for nearly three years. The charges feel excessive, especially considering I am careful to use only the services I need.",1
4291-SHSBH,"I've been experiencing frequent internet outages with the fiber optic service, which is unacceptable given the high monthly charges.",1
4291-SHSBH,"I contacted customer support regarding the internet issues, but the response was unhelpful and no resolution was provided.",2
4291-SHSBH,The lack of included services like online security or tech support for the price I'm paying feels unfair and makes me question the value of this subscription.,3
3583-EKAPL,"The streaming movies service is not working properly. I've been trying to watch movies, but the service keeps buffering or failing to load altogether. This is very frustrating, especially since I've just started my account.",1
7895-VONWT,"The streaming services I subscribed to, both TV and movies, often experience buffering and interruptions despite having a stable internet plan. This has been frustrating, and I expect a resolution to improve the quality of these services.",1
0617-AQNWT,"I've been a loyal customer for over five years, yet my internet speed has been consistently slower than advertised. This has been a persistent issue that has not been resolved despite reaching out earlier.",1
0617-AQNWT,"My streaming movie service frequently buffers, making it almost impossible to enjoy watching anything. This is unacceptable given how much I am paying monthly.",2
0617-AQNWT,"I specifically chose a plan with tech support, but when I called for help with my internet issues, I was put on hold for over an hour without resolution.",3
0617-AQNWT,"Despite not using paperless billing, I often receive billing statements late, which has caused unnecessary stress and confusion about payment deadlines.",4
0617-AQNWT,"I decided to cancel my service because of the continued poor performance and lack of resolution, but the cancellation process was unnecessarily complicated and time-consuming.",5
6719-OXYBR,"The internet speed is not as advertised. Despite paying for fiber optic, I often experience slow loading times, especially during peak hours.",1
6719-OXYBR,"The streaming TV service frequently buffers, making it nearly impossible to watch anything uninterrupted.",2
6719-OXYBR,"I contacted customer support about the buffering issue, but I was put on hold for over 30 minutes and didn’t receive a satisfactory resolution.",3
6719-OXYBR,The monthly charge is too high for the level of service I’m receiving. I feel I am not getting value for my money.,4
6719-OXYBR,I am frustrated that basic online security features are not included in my plan. I would expect this to be a standard offering given the high cost.,5
8894-JVDCV,"The streaming TV service often buffers and freezes during peak hours, making it nearly impossible to watch anything without interruptions.",1
8894-JVDCV,"Despite paying for premium fiber optic internet, I frequently experience inconsistent speeds, which affects both browsing and streaming.",2
8894-JVDCV,"The customer support team takes too long to respond when I report issues, and when they do, the solutions provided are often ineffective.",3
8894-JVDCV,"I noticed an unexpected increase in my monthly charges recently, and I haven't received any explanation or notification about this change.",4
7133-VBDCG,"The internet connection has been extremely inconsistent despite using fiber optic service. I've reported this issue multiple times, but it still hasn't been resolved, which is very frustrating and led me to cancel my service.",1
5380-AFSSK,"The streaming services I’ve been paying for are constantly buffering and lagging, making it impossible to enjoy watching TV or movies. Despite the high monthly charges, the quality of service has been very disappointing.",1
9391-DXGGG,"The internet speed is not consistent, and I often experience buffering while streaming movies, which is frustrating given the high monthly charges.",1
9391-DXGGG,"I have been paying for tech support, but the service is unavailable when I need assistance with my internet issues. This is unacceptable.",2
9391-DXGGG,Your customer service team is unresponsive and unhelpful when I try to report service issues. I expect better support for long-term customers.,3
0207-MDKNV,"The streaming services I signed up for, including both TV and movies, often buffer or fail to load altogether. This has been frustrating, especially since I'm paying a premium for Fiber optic internet.",1
0207-MDKNV,"Despite having tech support included, when I reached out for help with my streaming issues, the support team was unresponsive and did not resolve the problem.",2
7587-RZNME,"The DSL internet service has been extremely slow and unreliable despite paying $43.30 per month. Customer support has not provided any real assistance, which is why I decided to cancel my service.",1
9514-JDSKI,"The streaming TV service consistently buffers and lags, making it impossible to watch anything without interruptions. This is unacceptable, especially for a new customer.",1
9514-JDSKI,"I reached out to customer support regarding my streaming issues, but I received no clear resolution or follow-up. This lack of assistance is very frustrating.",2
9776-CLUJA,"The internet service has been consistently unreliable despite being on a fiber optic plan. I’ve had frequent outages and slow speeds, which is unacceptable given the high monthly charges. I had no choice but to cancel my service.",1
6365-MTGZX,"The streaming services I pay for, including TV and movies, frequently buffer or fail to load altogether, which has been very frustrating.",1
6365-MTGZX,"Despite paying for tech support, I struggled to get any meaningful assistance when I reported the streaming issues, and the problem still isn't resolved.",2
6365-MTGZX,"The fiber optic internet connection has frequent drops, making it impossible to enjoy the services I'm paying for.",3
6365-MTGZX,"The monthly charge of $96 is far too high given the consistent issues with the services, and I feel like I'm not getting what I paid for.",4
6365-MTGZX,I was charged for the month even though I decided to cancel due to these ongoing problems—I would like a refund for the unused services.,5
7036-ZZKBD,"The streaming movies service often buffers and has poor video quality, even though I am paying for it. This has been frustrating, and I would like this issue resolved immediately.",1
5931-FLJJF,"The internet service has been extremely unreliable, with frequent outages and slow speeds, making it difficult to complete basic tasks online.",1
5931-FLJJF,"I tried reaching out to customer support to resolve the internet issues, but no one was able to provide a satisfactory solution or timeline for fixing the problem.",2
5931-FLJJF,"Despite the poor service, my monthly bill remains high, and I don’t feel like I’m getting value for the amount I’m paying.",3
7688-AWMDX,"Despite being a long-term customer, my DSL internet speed has been consistently below what was promised in my plan. It's frustrating to deal with such slow speeds when I rely on a stable connection for work and other activities. Please resolve this issue promptly.",1
0479-HMSWA,"The streaming services I signed up for, both TV and movies, frequently buffer or crash, which disrupts my viewing experience. This has been ongoing for weeks, and I need it fixed immediately.",1
0479-HMSWA,"Despite having tech support included in my plan, it took ages to get through to a representative the last time I called, and they couldn't resolve my issue effectively. This level of support is unacceptable for the amount I’m paying.",2
6393-WRYZE,"The streaming services I signed up for frequently buffer or stop working altogether, even though I am paying a premium price for fiber optic internet. This has been a persistent issue, and I haven't received any resolution despite contacting support.",1
6393-WRYZE,"I was hoping to get better customer support for technical issues, but every time I try to reach out, I either get no response or unhelpful answers. This has left me feeling frustrated and undervalued as a customer.",2
2025-JKFWI,"The streaming services keep buffering, and the internet speed is inconsistent despite having a fiber optic connection. This has been ongoing for weeks, and I expected better service given the high monthly charges.",1
6289-CPNLD,"The streaming services, both TV and movies, have been buffering constantly, making it impossible to enjoy any content. I expect better service for what I'm paying.",1
6289-CPNLD,"The internet connection through DSL has been slow and unreliable, causing disruptions during work and entertainment time.",2
6289-CPNLD,"I contacted tech support regarding the internet issues, but the response was delayed, and the solution provided did not resolve the problem.",3
6289-CPNLD,"Despite having device protection, I was not given proper assistance when my modem stopped working, and I had to purchase a replacement myself.",4
6289-CPNLD,"The mailed check payment method is inconvenient, and I faced delays in processing my payments, leading to unnecessary stress.",5
6457-USBER,"The streaming movies service is constantly buffering and has poor quality, making it impossible to enjoy any content properly.",1
6457-USBER,"Your customer support team has been unhelpful in resolving my streaming issues. I've contacted them multiple times, but the problem remains.",2
6457-USBER,"The monthly charges are too high for the limited services I’m receiving, especially considering the ongoing issues with streaming.",3
0754-UKWQP,"The internet speed is terrible, especially for a fiber optic connection. Streaming movies and TV shows constantly buffer, which ruins the experience.",1
0754-UKWQP,"I called customer service to report the slow internet issue, but the response was unhelpful and they failed to resolve the problem.",2
0754-UKWQP,My monthly charges are too high for the quality of services provided. I'm not getting the value I expected for $95.85 per month.,3
0754-UKWQP,There was no clear communication about additional fees for services like device protection. I feel misled about the pricing.,4
0754-UKWQP,The process of canceling my subscription was overly complicated and frustrating. It took multiple calls just to ensure my account was closed.,5
4664-NJCMS,"The streaming services I subscribed to, including TV and movies, often experience buffering or interruptions, making it difficult to enjoy my content.",1
4664-NJCMS,"Despite having tech support included in my plan, I had to wait an unusually long time to get assistance when I reported the issue with streaming.",2
4664-NJCMS,The DSL internet speed is not consistent and doesn't seem to match the rates I’m paying for—it's often slower than expected.,3
4664-NJCMS,"I noticed that my monthly charges have slightly increased over time, and I would like an explanation for these changes.",4
5708-EVONK,"The streaming movies service frequently buffers and often has poor video quality, making it difficult to enjoy watching. This has been a recurring issue despite having a fiber optic connection.",1
5708-EVONK,"I contacted customer support about the streaming issue, but they were unable to provide a resolution or timeline for fixing the problem, which is very frustrating.",2
0970-ETWGE,"The streaming services I signed up for, both TV and movies, keep buffering and are nearly unusable. This is unacceptable given the high monthly charges for fiber optic internet.",1
0970-ETWGE,"I contacted customer support about the streaming issues, but they were unhelpful and provided no resolution.",2
0970-ETWGE,"My internet connection is unstable despite being on fiber optic, which I expected to be fast and reliable.",3
0970-ETWGE,"I've only been a customer for a month, and I'm already considering leaving because of the poor service quality and lack of support.",4
0970-ETWGE,The electronic check payment method is inconvenient and caused delays in processing my bill. I would prefer more flexible payment options.,5
3334-CTHOL,"The phone service quality has been extremely poor, with frequent dropped calls and bad signal strength. Despite having multiple lines, I am unable to use the service effectively, which is frustrating given the cost.",1
7102-JJVTX,"The internet speeds with my DSL service are much slower than what was advertised, making it difficult for my family to use the internet efficiently. This has been an ongoing issue, and I would like it resolved as soon as possible.",1
2027-FECZV,"The streaming services I signed up for, including TV and movies, frequently buffer and lag, making it impossible to enjoy any content. Despite paying a high monthly charge, the quality of service has been incredibly frustrating.",1
5624-BQSSA,"I signed up for phone service expecting reliable connectivity, but I've been dealing with dropped calls and poor call quality since the beginning. This is unacceptable, especially as a new customer.",1
6651-AZVTJ,"The internet service has been consistently unreliable, especially during streaming. Both TV and movie streaming frequently buffer or disconnect, making it impossible to enjoy the services I’m paying for. Despite contacting support previously, the issue remains unresolved.",1
4118-CEVPF,"The monthly charges are extremely high despite having a one-year contract. I feel like I’m not getting a reasonable price for the services I’m using, and I would like to discuss better pricing options.",1
0022-TCJCI,"The internet speed has been consistently slower than what was promised in my plan, and despite being a long-time customer, the issue has not been resolved.",1
0022-TCJCI,"I have called customer support multiple times regarding the slow internet, but I either get no response or vague promises without any follow-up.",2
0022-TCJCI,"I was recently charged an unusually high monthly bill, and there was no explanation or breakdown for the charges.",3
