customerID,complaint,complaint_number
1725-IQNIY,"The internet service has been consistently unreliable despite having fiber optic, which I was told would be faster and more stable. I've experienced slow speeds and interruptions during critical times.",1
1725-IQNIY,"Even though I pay a premium for multiple services, the streaming TV and movies frequently buffer or fail to load, which is very frustrating.",2
1725-IQNIY,"When I sought help from tech support regarding these issues, the response was unhelpful and slow, leaving my problems unresolved.",3
4695-WJZUE,"The streaming movies service often buffers and has poor quality, which makes it nearly impossible to enjoy watching anything. I expected better performance for the price I'm paying.",1
4695-WJZUE,"I reached out to customer support about my streaming issues, but I haven't received any helpful resolution. The lack of tech support is very frustrating.",2
5049-GLYVG,"The phone service quality is extremely poor. I experience frequent call drops and unclear audio, which makes it very frustrating to use.",1
5049-GLYVG,"Despite having no internet service, I still feel like the overall charges are too high for what I'm getting. I don't think the service is worth the cost.",2
5049-GLYVG,"The process of mailing a check every month is inconvenient and outdated. I would have preferred more modern payment options, but none were suggested during signup.",3
2055-PDADH,"The internet service is extremely unreliable with frequent outages. As a senior citizen relying on online services, this is causing a lot of frustration and inconvenience.",1
2055-PDADH,"When I tried to contact customer support to resolve the internet issues, I received no meaningful assistance. The lack of tech support has made the situation worse.",2
5268-DSMNQ,"The streaming TV service frequently buffers or freezes, making it difficult to watch anything without interruptions. I expect better performance for the price I'm paying.",1
5268-DSMNQ,"I have been experiencing occasional drops in my fiber optic internet connection, which is very frustrating when I'm trying to work or stream content.",2
5268-DSMNQ,"The tech support service is not included in my plan, and I feel like I have no way to get help when I encounter technical issues. This is unacceptable for a long-term customer like me.",3
5268-DSMNQ,"My monthly charges are quite high, and I don't feel like I'm getting the value I was promised when I signed up. Can you review my plan and offer a more reasonable rate?",4
5268-DSMNQ,"Despite being a loyal customer for over five years, I haven't received any loyalty rewards or discounts. I would appreciate recognition for my continued business.",5
6332-FBZRI,"Despite having a long-term contract and paying consistently for years, my DSL internet speed is not up to standard. It often slows down during peak hours, making it difficult to complete work or stream content for my family. Please address this issue immediately.",1
2737-WFVYW,"The streaming services I signed up for, like TV and movies, constantly buffer and freeze. It's frustrating, especially since I'm paying for DSL internet, and the issue hasn't improved since I started my subscription.",1
5980-NOPLP,"The internet service is extremely unreliable with frequent outages, which is unacceptable for the high monthly charges I’m paying.",1
5980-NOPLP,"I have been trying to get help with the connectivity issues, but every time I contact customer support, I’m told there’s nothing they can do without tech support, which I don’t have.",2
5980-NOPLP,"The streaming services I pay extra for often buffer or fail to load completely, making it impossible to enjoy TV or movies.",3
5980-NOPLP,"I tried to upgrade my plan to include tech support for assistance, but the process was confusing and the representative was not helpful.",4
5980-NOPLP,"Considering all these issues and the lack of resolution, I am frustrated that I’ve paid over $4,000 for a service that doesn’t meet my expectations.",5
5792-JALQC,"The telephone service has been dropping calls frequently, which is very frustrating, especially when I'm trying to make important calls.",1
5792-JALQC,"The DSL internet speed is much slower than promised, making it difficult for me to complete online tasks efficiently.",2
5792-JALQC,I noticed that my device protection service does not seem to be working properly as my devices have been experiencing issues despite being covered.,3
5792-JALQC,"I called customer support to resolve these issues, but I was put on hold for an unreasonably long time and never received a proper resolution.",4
1591-NFNLQ,"The internet speeds with my fiber optic service have been inconsistent, especially during peak hours, making it difficult to use reliably. Despite being a long-term customer, I feel the service quality has not improved.",1
1591-NFNLQ,"When I reached out to customer support about the internet issues, I was told there’s no resolution timeline. The lack of tech support availability has been very frustrating.",2
2342-CKIAO,"I've been trying to reach customer service to ask questions about my plan, but the wait times are excessively long. This is very frustrating and inconvenient.",1
2342-CKIAO,I noticed that my bill amount is slightly higher than what I expected for the services I use. Can you please clarify why this is happening?,2
2342-CKIAO,"I mailed my payment on time, but it seems like there was a delay in processing it. This caused unnecessary stress, and I would like an explanation.",3
5438-QMDDL,"The streaming movies service I signed up for frequently buffers and has poor quality. This has been happening for weeks, and it’s very frustrating to not get the service I’m paying for. Please resolve this issue as soon as possible.",1
8017-UVSZU,"Despite being a long-time customer, I am disappointed that I constantly have to deal with poor internet speeds and frequent disruptions. It's frustrating that even with DSL and a steady payment history, the service quality hasn't improved.",1
4191-XOVOM,"The monthly charges for my services are too high compared to what I believe is fair. I feel like I am being overcharged for the features I use, and I would like to discuss lowering my bill.",1
4191-XOVOM,"The streaming services I pay for often buffer or experience interruptions, even though I have fiber optic internet. This is very frustrating, especially when I pay a premium for these services.",2
6108-OQZDQ,"The streaming services I signed up for, both TV and movies, constantly buffer and experience interruptions. It's frustrating to pay such a high monthly charge for subpar service. I need this issue resolved immediately.",1
4690-PKDQG,"The fiber optic internet service is not meeting my expectations. I've been experiencing frequent outages and inconsistent speeds, which is frustrating given the high monthly charges.",1
4690-PKDQG,"I tried contacting customer support about my internet issues, but the lack of tech support included in my plan made it difficult to get adequate assistance. This is very disappointing.",2
0634-SZPQA,"The streaming TV service frequently buffers and has poor video quality, even though I am paying for a high-speed fiber optic internet connection. This has made it impossible to enjoy the service.",1
4385-ZKVNW,"The internet speed has been inconsistent lately, and it’s affecting my ability to work from home. I expect a more stable connection given the price I'm paying.",1
4385-ZKVNW,"The online backup service isn't syncing my files properly, and I’m worried about losing important documents. This issue needs to be resolved immediately.",2
4385-ZKVNW,"I contacted tech support about my internet issue, but the troubleshooting steps they provided didn’t resolve the problem. I’m frustrated with the lack of effective assistance.",3
4385-ZKVNW,I’ve noticed that my monthly charges have gradually increased over time without any explanation. I need clarification on why this is happening.,4
4385-ZKVNW,"Despite being a long-term customer, there seems to be no loyalty benefits or discounts offered to me. I feel undervalued and would like to discuss this.",5
4749-VFKVB,"The call quality on my phone line is terrible, and I frequently experience dropped calls. It’s frustrating to pay for a service that doesn’t work properly.",1
4749-VFKVB,"I signed up for DSL internet, but the speeds are far slower than advertised. This is unacceptable for even basic browsing.",2
4749-VFKVB,"I contacted customer service about my slow internet, but they were unhelpful and didn’t provide any resolution.",3
4749-VFKVB,"I feel like I’m being overcharged for the services I’m receiving, especially since I don’t have any add-ons like Online Security or Device Protection.",4
4749-VFKVB,It’s inconvenient that I have to use mailed checks for payments when I prefer more modern options like card payments or online transfers.,5
7240-ETPTR,"The streaming TV and movies services frequently buffer and are of poor quality, making it frustrating to watch anything. I've tried troubleshooting, but the problem persists.",1
7240-ETPTR,"I feel like I'm paying too much for services that don't work properly, especially since I don't have phone service or additional security features included.",2
7240-ETPTR,"When I reached out to customer support about my issues, I was not given a satisfactory resolution or timeline for fixing the problems, which led me to cancel my service.",3
7248-VZQLC,"The internet service has been consistently unreliable and slow, especially considering the high monthly charges. This has been a recurring issue that has not been resolved despite my long tenure as a customer.",1
7248-VZQLC,"I reached out for technical support regarding my internet issues, but I was informed that I do not have access to tech support. For the amount I'm paying, I expect better customer service options.",2
4526-EXKKN,"I've been receiving paperless billing notifications, but the details are often unclear and confusing. I would prefer clearer communication or more detailed billing statements to avoid any misunderstandings.",1
4890-VMUAV,"The phone service quality has been poor lately, with frequent call drops and static interference during calls. This is frustrating given how long I've been a customer.",1
4890-VMUAV,"My DSL internet speed is much slower than what was promised when I signed up, and it often struggles to handle basic browsing.",2
4890-VMUAV,"When I reached out to tech support about the internet issues, I had to wait an unreasonably long time to get through, only to receive generic troubleshooting advice that didn't resolve the problem.",3
4890-VMUAV,"Despite paying for multiple services like Online Security and Device Protection, I feel like the value I’m getting doesn’t justify the high monthly charges.",4
5495-GPSRW,"The phone service has frequent call drops, and the sound quality during calls is often poor. This has been a persistent issue that needs to be resolved.",1
5495-GPSRW,I am not satisfied with the lack of internet services offered in my area. It's frustrating that I cannot bundle internet with my phone service.,2
5495-GPSRW,The process of mailing checks every month is inconvenient. I would prefer more flexible payment options that align with modern conveniences.,3
3565-UNOCC,"The internet speed on my fiber optic connection has been consistently slow despite the high monthly charges, making it difficult to stream TV and movies without buffering issues. I have contacted customer support in the past, but no resolution has been provided.",1
4072-IPYLT,"The DSL internet service I am using is much slower than expected for the price I am paying. It often struggles to load even basic webpages, which is very frustrating.",1
4072-IPYLT,"I was told that Online Security would protect me from malware, but I recently experienced a security breach on my devices. This raises concerns about the reliability of the service.",2
4072-IPYLT,There seems to be no option to upgrade my internet speed without significantly increasing my monthly charges. This is disappointing and feels very restrictive.,3
4072-IPYLT,I needed assistance with a technical issue but realized I don't have access to Tech Support. It’s frustrating to have no help when I encounter problems.,4
4072-IPYLT,"Your billing process is not transparent enough. While I’m not using paperless billing, the invoices I receive lack clear breakdowns of charges, making it hard to verify them.",5
8361-LTMKD,"The internet speed with Fiber Optic has been extremely disappointing. Despite paying a premium, the connection is inconsistent and makes it difficult to complete online tasks.",1
8361-LTMKD,"I have been experiencing dropped calls and poor voice quality on my phone service, which is unacceptable given that I rely on it heavily for communication.",2
8361-LTMKD,"When I reached out to customer support about my internet and phone issues, I was put on hold for an extended period and never received a proper resolution.",3
8361-LTMKD,"The monthly charges are too high for the limited services I am receiving, and I am frustrated that no effort has been made to address my concerns or offer a discount.",4
1122-JWTJW,The internet speed has been extremely slow despite having a fiber optic connection. It's making it difficult to complete any online tasks efficiently.,1
1122-JWTJW,"I was expecting better service for the price I’m paying, but there’s no tech support available to help resolve my issues.",2
1122-JWTJW,"None of the additional services like online security or backup were offered, which feels like a lack of value for the cost.",3
1122-JWTJW,"The billing process is inconvenient and unclear. Even though I opted for paperless billing, I received no notification or clear breakdown of my charges.",4
1122-JWTJW,"I’m frustrated with the lack of options or assistance to retain me as a customer, which is why I have no choice but to leave.",5
5275-SQEIZ,"The streaming movies service I signed up for has been buffering excessively, making it impossible to enjoy any content. This has been happening since I joined.",1
5275-SQEIZ,"I reached out for support regarding the streaming issue, but I was informed that tech support isn't included in my plan. Why isn't there an option for basic assistance?",2
5275-SQEIZ,The monthly charges feel excessive given the lack of functioning services and support. I believe I am overpaying for what I am receiving.,3
4456-RHSNB,"The internet speed has been consistently slower than expected for a DSL connection, making it difficult to complete basic tasks. I need this issue resolved soon.",1
4456-RHSNB,"I have noticed that my monthly charges seem higher than they should be, given that I don't use services like Online Security or Online Backup. Please review my bill.",2
4456-RHSNB,"When I reached out to customer support about the internet issues, I was not provided with a helpful resolution. I expect better assistance moving forward.",3
0818-OCPZO,"The internet speed has been extremely inconsistent, making it difficult to perform basic tasks online. It’s frustrating to pay for fiber optic service and not receive reliable performance.",1
0818-OCPZO,"I tried reaching out to tech support for help with my internet issues, but I was unable to get any assistance since I don’t have tech support included in my plan. This lack of support is unacceptable for a loyal customer.",2
2080-GKCWQ,"The internet connection is inconsistent, with frequent drops in service, making it difficult to complete important work tasks.",1
2080-GKCWQ,"I signed up for online backup, but I recently discovered that some of my files are not being backed up as expected.",2
2080-GKCWQ,The monthly charges for Fiber optic internet are quite high compared to the service quality I am receiving.,3
2080-GKCWQ,"When I called customer support about my internet issues, I was kept on hold for over 30 minutes and didn't receive a clear resolution.",4
2080-GKCWQ,"I opted for a non-paperless billing method, but I still haven’t received my last month’s bill in the mail.",5
9436-ZBZCT,"The internet service has been unreliable, with frequent outages and slow speeds, which is unacceptable given the high cost of Fiber optic.",1
9436-ZBZCT,"I signed up for Streaming TV, but the service often buffers or fails to load content, making it almost unusable.",2
9436-ZBZCT,The tech support team has not been helpful in resolving my ongoing issues with internet stability and Streaming TV performance.,3
9436-ZBZCT,"The monthly charges are too high for the quality of services provided, and I feel like I'm not getting value for my money.",4
7636-OWBPG,"I am frustrated with the lack of online security features in my internet service. As a senior citizen, I am concerned about potential risks while browsing, and I expect better protection from my provider.",1
9625-QSTYE,"The internet service has been incredibly unreliable, with frequent outages, which has made it difficult to complete my work or use my devices effectively. Despite paying a high monthly fee, the quality of service has not improved.",1
8017-LXHFA,"The streaming services I signed up for frequently buffer or fail to load, even though I am paying for a high-speed fiber optic connection. It’s frustrating to deal with this issue, especially since I’m paying nearly $95 a month for unreliable service.",1
8740-CRYFY,"The streaming TV service is constantly buffering, making it impossible to watch anything without interruptions. This has been incredibly frustrating.",1
8740-CRYFY,"Despite paying for fiber optic internet, the speeds are much slower than expected, and it's impacting my ability to use the service effectively.",2
8740-CRYFY,"I tried reaching customer support about my internet and streaming issues, but I couldn't get any resolution after being on hold for a long time.",3
8740-CRYFY,I am being charged a high monthly fee for services that are not meeting the quality I was promised. I want a refund or compensation for this experience.,4
7481-ATQQS,"The internet connection has been extremely unreliable, with frequent outages and slow speeds, making it difficult to use my streaming service effectively.",1
7481-ATQQS,"I am frustrated that despite being a long-time customer, I am not offered any loyalty discounts or incentives to stay, especially with the high monthly charges.",2
7481-ATQQS,"The tech support service is non-existent. Each time I experience issues with my internet, there is no one available to assist me, and I end up troubleshooting on my own.",3
7481-ATQQS,"The lack of online security options is concerning, and I feel my personal information is at risk due to the lack of adequate protection.",4
7481-ATQQS,"I was charged for streaming movies, but the service quality is subpar, with constant buffering and interruptions. This is unacceptable given the high price I pay.",5
0952-KMEEH,"The streaming services I signed up for keep buffering and the video quality is poor. Despite having fiber optic internet, the performance is not meeting my expectations, and it's frustrating to pay such a high monthly charge for subpar service.",1
5318-YKDPV,"The streaming services keep buffering despite having a stable DSL connection. This has been frustrating, especially during family movie nights.",1
5318-YKDPV,The monthly charges seem to be increasing without any clear explanation. I need a detailed breakdown of my bill to understand these changes.,2
1582-RAFML,"The internet speed with my DSL service has been extremely disappointing, making it difficult to complete even basic tasks online. I reached out to tech support for assistance, but the problem still hasn't been resolved.",1
5899-MQZZL,"The internet service has been unreliable with frequent outages, which is unacceptable for the price I'm paying.",1
5899-MQZZL,"I’ve called customer support multiple times about the internet issues, but I’ve received no helpful solutions or follow-up.",2
5899-MQZZL,"Despite not using online security or backup services, I feel there is no value added for the high monthly charges.",3
5899-MQZZL,"The billing process is cumbersome, and I have experienced delays in processing my mailed checks.",4
5899-MQZZL,"I’m frustrated with the lack of flexibility or incentives to retain long-term customers, which is why I decided to leave.",5
7244-QWYHG,"The streaming TV service often buffers or freezes, even though I have a stable DSL internet connection. This has been happening frequently, and it's very frustrating.",1
7244-QWYHG,I noticed that the monthly charges for my plan have increased slightly over time without any explanation. I would like clarification on why this is happening.,2
7244-QWYHG,The tech support service is not as responsive as it should be. It takes too long to get assistance when I encounter issues with my internet or streaming services.,3
7244-QWYHG,I'm unable to access some channels on the streaming TV service that were previously available. I would like to know why these channels are no longer included in my plan.,4
5671-UUNXD,"The fiber optic internet connection is frequently disrupted, especially during peak hours. This has caused significant inconvenience when trying to stream TV and movies.",1
5671-UUNXD,I recently noticed that my monthly bill has been steadily increasing without any clear explanation. I need a detailed breakdown of the charges.,2
5671-UUNXD,"Despite having tech support included in my plan, it takes an unreasonably long time to get assistance when issues arise. The response times need to improve.",3
5671-UUNXD,There is no option to bundle services or reduce costs despite being a loyal customer for over four years. I feel like long-term customers should be rewarded with better offers.,4
8008-OTEZX,"The phone service frequently drops calls, especially during important conversations. This has been a constant issue despite being a loyal customer for nearly three years.",1
8008-OTEZX,"The mailed check payment method is inconvenient, and I would like more modern payment options, such as online or electronic billing, to simplify the process.",2
4652-NNHNY,"The internet service is too expensive for the quality provided. Despite paying a high monthly fee, I don't have access to basic features like online security or device protection.",1
4652-NNHNY,"Customer support was unhelpful when I tried to address the high costs and lack of included services, which ultimately led me to cancel my subscription.",2
4789-KWMXN,"The fiber optic internet service has been consistently unreliable with frequent outages, making it difficult to stream TV and movies or work efficiently online. Despite having tech support included, my issues have not been resolved in a timely manner, which is very frustrating.",1
7517-LDMPS,"The streaming movies service often buffers and interrupts my viewing experience, which is very frustrating considering the high monthly charges I pay. I expect a smoother service for the cost.",1
9889-TMAHG,The internet speed has been consistently slow despite having a Fiber optic connection. This is unacceptable given the high monthly charges.,1
9889-TMAHG,"I've been experiencing frequent buffering issues while streaming movies and TV shows, which makes the service unusable at times.",2
9889-TMAHG,The tech support service has not been helpful in resolving my internet issues despite multiple calls and escalations.,3
9889-TMAHG,I was charged for this month even after I decided to cancel my subscription. I expect an immediate refund.,4
7841-TZDMQ,"The internet speed has been consistently slow since I signed up, making it difficult to browse or stream anything effectively.",1
7841-TZDMQ,"I reached out to customer support about the slow internet, but they were unhelpful and failed to resolve the issue.",2
7841-TZDMQ,I was charged for a full month even though I canceled my service partway through the billing cycle.,3
7841-TZDMQ,"The cancellation process was unnecessarily complicated, and I did not receive clear guidance on how to return equipment or finalize my account.",4
0771-CHWSK,"I have been a loyal customer for over five years, and yet there has been no loyalty discount or reward offered to me despite consistently paying my bills on time.",1
0771-CHWSK,"The streaming movies service has frequent buffering issues, which ruins my viewing experience. Even though I pay for this service, it doesn't perform as it should.",2
0771-CHWSK,"Despite having device protection, I had to replace a faulty modem at my own expense, and the customer support was unhelpful in resolving this matter.",3
0771-CHWSK,"Your tech support service is unavailable to me, and I had to troubleshoot my internet issues on my own, which is frustrating given how much I pay monthly.",4
0771-CHWSK,"The monthly charges keep increasing without clear communication or justification, and I feel like I’m being overcharged compared to other providers.",5
0023-HGHWL,The DSL internet service is incredibly slow and makes it difficult to complete even basic tasks like checking emails. This is unacceptable for the price I'm paying.,1
0023-HGHWL,"I attempted to contact customer support about the slow internet, but I was unable to get through to anyone who could help me resolve the issue.",2
0023-HGHWL,"There is no tech support included with my plan, which leaves me stranded whenever I face technical issues. This is very frustrating.",3
0023-HGHWL,I am being charged $25.10 for what feels like a completely subpar service. I do not believe the value justifies the cost.,4
0023-HGHWL,"The month-to-month contract feels like a trap because the service quality does not improve, and I feel forced to leave due to poor service and no resolution.",5
