customerID,complaint,complaint_number
6339-RZCBJ,"My streaming services, both TV and movies, frequently buffer or fail to load altogether, even though I'm paying for a reliable connection. This has been an ongoing issue and needs immediate resolution.",1
6339-RZCBJ,"I’ve noticed that despite being a long-term customer with a two-year contract, there hasn’t been any effort to offer loyalty discounts or rewards. I feel undervalued as a customer.",2
5642-MHDQT,"I've been a loyal customer for over four years, yet I feel like I'm not getting any benefits or incentives for staying with your service. It would be nice to see some loyalty rewards.",1
5642-MHDQT,I don't understand why my monthly charges are this high when I only have phone service. Can you please provide a detailed breakdown of my bill?,2
9921-QFQUL,The streaming movies service constantly buffers and takes too long to load. It's frustrating to pay for a premium internet service and still experience such poor performance.,1
8735-DCXNF,"Despite having tech support and online security, my internet connection has been dropping frequently over the past month, which is frustrating as I rely on it for work. I need this issue resolved immediately.",1
6711-FLDFB,The internet speed is extremely slow despite being on fiber optic. This has made it almost impossible to use the service for basic tasks like browsing or video calls.,1
6711-FLDFB,"Every time I try to reach customer service to address the internet issues, the wait times are unreasonably long, and I rarely get a helpful response.",2
6711-FLDFB,I'm unhappy with the lack of tech support options available to help me resolve issues with my connection. It's frustrating to feel like there's no assistance when I need it.,3
6711-FLDFB,"The monthly charges are too high for the level of service I'm receiving. I feel like I'm paying for features I don't use, and the value just isn't there.",4
8835-VSDSE,"The internet speed with the fiber optic service has been inconsistent and much slower than expected, which is very frustrating as I rely on it for daily tasks.",1
8835-VSDSE,"I've faced frequent disruptions with my internet connection, and despite contacting customer support, the issue has not been resolved.",2
8835-VSDSE,The customer service team has been unhelpful and unresponsive when I reached out to report recurring connectivity issues.,3
8835-VSDSE,"I was charged the full amount this month even though the internet service was unreliable for several days, and I believe I deserve a partial refund.",4
8835-VSDSE,"The lack of included services like online security, backup, and tech support for the high monthly charges makes the plan feel overpriced and not worth continuing.",5
0397-GZBBC,"The internet service is extremely unreliable, and the streaming services constantly buffer or disconnect, making it impossible to enjoy TV or movies.",1
0397-GZBBC,"I contacted customer support about the poor internet and streaming performance, but they were unhelpful and did not provide any solutions.",2
0397-GZBBC,"Despite the ongoing issues, my monthly charges remain high, and I feel like I'm not getting value for the amount I'm paying.",3
6892-XPFPU,"The internet service is extremely unreliable, especially for the high price I’m paying each month. Streaming TV and movies constantly buffer, and this has been a persistent issue despite my attempts to resolve it with customer support.",1
6603-QWSPR,"The monthly charges for my services are incredibly high, especially considering I don't even have Online Security. I feel like I'm not getting enough value for the amount I'm paying.",1
1977-STDKI,"The internet speeds with the fiber optic service have been extremely disappointing. Pages take forever to load, and streaming anything is impossible.",1
1977-STDKI,"I tried reaching out to your customer support about the slow internet, but I couldn't get any helpful assistance. The representative seemed uninterested in resolving my issue.",2
1977-STDKI,"Despite my issues, my monthly bill of $73 feels excessive for the limited services I'm receiving. I don't feel like I'm getting my money's worth.",3
3173-NVMPX,"The internet speed has been much slower than expected for a DSL connection, making it difficult to complete online tasks efficiently. This has been a recurring issue that needs urgent resolution.",1
3173-NVMPX,"I signed up for Online Backup, but I have concerns about its reliability. Some of my files seem to be missing or not properly backed up.",2
3173-NVMPX,"Whenever I try reaching out for assistance with my internet or backup issues, the lack of Tech Support as part of my service package has left me feeling stranded.",3
3173-NVMPX,"Considering the monthly charges I am paying, I feel the value of the services provided is not up to the mark. I would appreciate better service or a reduction in charges.",4
4355-HBJHH,"The streaming services for TV and movies frequently buffer and crash, making it impossible to enjoy content. Despite having a stable internet connection, this issue has persisted for months.",1
4355-HBJHH,"I have been charged a high monthly fee of $79.70, but the quality of service, particularly the streaming and internet speed, does not match the cost. It feels like I am overpaying for subpar services.",2
4355-HBJHH,"I contacted customer support about the streaming issues, but they were unhelpful and did not provide a resolution. I feel frustrated with the lack of assistance.",3
4355-HBJHH,"The payment system using electronic checks has caused delays and errors in processing my payments, leading to unnecessary stress and confusion. This needs to be addressed immediately.",4
4765-OXPPD,"The DSL internet service has been extremely slow and inconsistent, making it difficult to complete important tasks for my family. Despite having OnlineSecurity and TechSupport, I haven't seen any improvements.",1
4765-OXPPD,"I have repeatedly contacted customer service about the internet issues, but the responses have been unhelpful and no lasting solution has been provided.",2
4765-OXPPD,The monthly charges of $65.00 feel excessive considering the poor quality of the internet service and lack of resolution to my complaints.,3
7851-WZEKY,"The streaming services for TV and movies often buffer or freeze during playback, which ruins my viewing experience. I've already tried troubleshooting on my end, but the issue persists.",1
7851-WZEKY,"The internet speed is not as advertised for fiber optic service. I'm paying for high-speed internet but still experience frequent lags, which affects both my streaming and general browsing.",2
7851-WZEKY,"I contacted customer support about these issues, but they were unhelpful and did not provide any resolution. This lack of service is unacceptable.",3
9330-IJWIO,"The streaming services I signed up for frequently buffer or don’t load at all, even though I’m paying a premium price for fiber optic internet. This has been a persistent issue, and I’m extremely frustrated with the lack of resolution.",1
7734-DBOAI,"The streaming TV service I signed up for has been buffering and freezing constantly, making it impossible to enjoy any shows. This has been very frustrating, especially since I specifically chose this service to relax with my family.",1
0526-SXDJP,"I have been a loyal customer for six years, but I feel like I'm not receiving any rewards or benefits for my long-term commitment. It would be great if you offered loyalty discounts or perks.",1
0526-SXDJP,"There have been frequent slowdowns in my DSL internet connection, especially during peak hours, which disrupts my work and browsing.",2
0526-SXDJP,"I pay for multiple protection services, but I recently had a security issue that wasn't resolved properly. This makes me question the reliability of these services.",3
0526-SXDJP,"I don’t use streaming services, yet my monthly charges seem quite high compared to what I actually use. Please review my billing and let me know why this is the case.",4
1173-NOEYG,"The internet service has been inconsistent lately, with frequent interruptions during the day, which is frustrating given the high cost of Fiber optic.",1
1173-NOEYG,"I rely on streaming movies, but the buffering and lag have made it nearly impossible to enjoy. This issue has persisted even with device protection enabled.",2
1173-NOEYG,"Despite being a long-time customer, I feel like I'm not receiving sufficient support to address these recurring issues, especially since I don't have access to tech support.",3
8166-ZZTFS,"I am extremely disappointed with the lack of technical support provided, especially after being a loyal customer for over five years. Despite paying a high monthly charge, I had to deal with unresolved issues with my streaming services and internet connection, which ultimately forced me to cancel my contract.",1
4929-XIHVW,"The streaming services I signed up for, including TV and movies, frequently buffer or fail to load altogether. For the high monthly charges I'm paying, I expect a much better experience. Please resolve this issue as soon as possible.",1
2446-ZKVAF,"The internet speed with my DSL service has been very slow lately, making it difficult to complete even basic online tasks. I'd like this issue to be resolved as soon as possible.",1
2446-ZKVAF,"I have noticed that my online backup service is not functioning properly. Files are not being backed up as expected, and I need assistance getting this fixed.",2
2446-ZKVAF,"Despite reaching out about slow internet speeds, the issue remains unresolved, and I haven't received any updates. The lack of communication is frustrating.",3
2403-BCASL,"The internet service has been extremely unreliable despite paying a premium for fiber optic. Frequent outages and slow speeds have disrupted my work and entertainment, and I feel like I'm not getting the service I'm paying for.",1
7330-WZLNC,"The streaming TV service constantly buffers and interrupts my viewing experience, making it impossible to watch anything without frustration. Despite paying a high monthly charge, the issue has not been resolved.",1
8513-OLYGY,"The streaming services are frequently buffering, even though I’m paying for fiber optic internet. This is extremely frustrating when trying to watch TV or movies.",1
8513-OLYGY,The monthly charges seem excessively high compared to what other providers offer for similar services. I’d like a review of my billing to ensure I’m not being overcharged.,2
3766-EJLFL,"My monthly bill has been consistently high at $109.05, and I feel like I'm not getting enough value for the services provided. I would like to discuss options for reducing my bill.",1
3766-EJLFL,"The streaming services frequently buffer or freeze, especially during peak hours, which is very frustrating for my family when trying to watch TV or movies.",2
3766-EJLFL,"Despite having tech support included in my plan, it often takes a long time to get a response or resolution when I reach out for help with service issues.",3
4713-LZDRV,"The streaming service for movies keeps buffering and is almost unwatchable. I am paying a premium price, and I expect better performance.",1
4713-LZDRV,"When I tried to contact customer support about the streaming issues, I was unable to get through or receive any meaningful assistance. This has been extremely frustrating.",2
4713-LZDRV,I noticed that my bill seems unusually high considering the limited services I use. Can you please provide a detailed explanation or review these charges?,3
9158-VCTQB,"My monthly bill has been increasing significantly without any clear explanation. Despite being a loyal customer for over three years, I feel like I am being overcharged for services. I would like a detailed breakdown of my charges and an explanation for the high costs.",1
8058-INTPH,"The streaming TV service is constantly buffering and the quality is poor. I expected better performance, especially for the price I'm paying.",1
8058-INTPH,"I reached out to customer support about the streaming issues, but I didn’t receive any helpful assistance. The representative seemed uninterested in resolving my problem.",2
8058-INTPH,"I feel the monthly charges are too high for the limited services I’m receiving, especially since most of the add-ons like online security and tech support aren’t included.",3
1834-ABKHQ,"I've been a loyal customer for over four years, but I'm frustrated that I don't have access to better internet security options with my DSL service. It's concerning that my online activity isn't adequately protected, and I'd like to know if there are plans to offer more robust security features.",1
8063-RJYNF,"The streaming services for TV and movies are constantly buffering despite having fiber optic internet, which I expected to be fast and reliable. It’s frustrating to pay such a high monthly charge for subpar performance.",1
9415-ZNBSX,"I’ve been a loyal customer for nearly six years, but lately, the streaming services I’m paying for have been buffering constantly, making it impossible to enjoy movies or TV shows.",1
9415-ZNBSX,"Despite having all the security and protection services enabled, I keep receiving phishing emails and suspicious pop-ups. I expected better security for the premium I'm paying.",2
9415-ZNBSX,"The automatic bank transfer process for my bill payments has had errors twice now, leading to late fees and unnecessary stress. This needs to be resolved immediately.",3
6689-KXGBO,"The internet speed has been extremely slow since I signed up, and it’s making it difficult to complete even basic tasks online. It doesn’t feel like I’m getting the service I’m paying for.",1
6689-KXGBO,"I tried reaching out to customer support multiple times about the internet issues, but I either couldn’t get through or wasn’t provided with any helpful solutions.",2
6689-KXGBO,I’m frustrated that I was required to pay the full amount for the first month despite the poor service and lack of resolution. I would like a refund or adjustment to my charges.,3
0823-HSCDJ,"The streaming services I signed up for, including TV and movies, frequently buffer and sometimes fail to load altogether. This has been a consistent issue despite being a long-time customer.",1
0823-HSCDJ,"I have no online security included with my internet service, which makes me feel vulnerable to potential cyber threats. I expected better protection from your company.",2
0823-HSCDJ,"The monthly charges for the service seem excessive, especially considering the performance issues I've been facing with streaming and the lack of additional features like tech support or device protection.",3
0823-HSCDJ,"Despite being a loyal customer for over four years, I feel like I haven’t been offered any incentives or benefits to stay, which is disappointing and one of the reasons I decided to leave.",4
3494-JCHRQ,"The internet service has been extremely unreliable since I signed up, with frequent outages and inconsistent speeds, making it impossible to use effectively.",1
3494-JCHRQ,"I contacted customer support about my internet issues, but they were unhelpful and failed to resolve the problem, leaving me frustrated.",2
3494-JCHRQ,"The monthly charge is too high for the limited services I receive, especially considering that I don't even have access to features like online security or backup.",3
3877-JRJIP,"The Streaming TV service is constantly buffering and making it impossible to watch anything. This is extremely frustrating, especially since I'm paying for it.",1
3877-JRJIP,"I contacted customer support about the buffering issue, but I was told to troubleshoot it myself without receiving any real help. This lack of support is unacceptable.",2
6692-UDPJC,"The internet service has been extremely unreliable, with frequent outages and slow speeds, even though I’m paying a premium for fiber optic. This has been a recurring issue, and despite having tech support, no lasting solution has been provided.",1
4016-BJKTZ,"The internet service has been extremely unreliable with frequent outages, which is unacceptable for the high monthly charges I'm paying. Despite having tech support included, the resolution time for these issues has been very slow.",1
6615-ZGEDR,"I am frustrated that even though I only signed up for phone service, the call quality has been poor with frequent dropped calls and static. This is unacceptable, especially as a new customer.",1
7083-YNSKY,"I've been experiencing frequent disruptions with my phone service, including dropped calls and poor call quality. Despite paying for multiple lines, the service has not met my expectations. I would like this issue resolved immediately.",1
1320-HTRDR,My internet connection has been consistently slow and unreliable despite paying for a higher-speed Fiber optic service. This is unacceptable.,1
1320-HTRDR,"I have no access to any additional security features like OnlineSecurity, which makes me concerned about the safety of my connection. Why is this not offered or at least suggested as an option?",2
1320-HTRDR,"I have been unable to get any device protection or tech support, and whenever I try to contact support, I am either put on hold for a long time or receive no resolution.",3
1320-HTRDR,The monthly charges are too high for the basic services I am receiving. I feel like I am overpaying for what I get.,4
1320-HTRDR,"I am frustrated with the lack of effort to retain me as a customer, and this is why I decided to leave. No loyalty discounts or incentives were offered to address my concerns.",5
0628-CNQRM,"The internet speeds on my DSL connection have been consistently below what was promised, and this has made streaming TV nearly impossible without constant buffering. Despite paying a premium for additional services like tech support and device protection, I haven't seen any resolution to this issue.",1
5569-KGJHX,"The internet speeds with the fiber optic service have been consistently slower than advertised, making it difficult to use the service effectively.",1
5569-KGJHX,"The streaming TV service frequently buffers or disconnects, even though I am paying for high-speed internet.",2
5569-KGJHX,"I have contacted customer support multiple times about these issues, but I have not received any resolution or adequate assistance.",3
5569-KGJHX,My monthly charges feel excessively high given the poor quality of service I have been experiencing. I would like a review of my account and billing.,4
3164-AALRN,"The streaming services are constantly buffering, making it impossible to watch TV shows or movies smoothly. This has been a recurring issue despite my attempts to troubleshoot.",1
3164-AALRN,My internet speed is much slower than what was promised when I signed up for the DSL service. It's affecting my ability to use online services effectively.,2
3164-AALRN,"I tried to contact customer support about these issues, but I was put on hold for an extended period and never received proper assistance.",3
1383-EZRWL,"The phone service quality has been poor, with frequent call drops and static on the line. It has been frustrating to make uninterrupted calls.",1
1383-EZRWL,"I have been trying to get information about internet service options, but the customer service representatives have been unhelpful and unresponsive.",2
1383-EZRWL,"Despite my efforts to resolve these issues, there seems to be no improvement in service, which ultimately led to my decision to cancel.",3
3424-NMNBO,"The streaming services I subscribed to, including both TV and movies, often buffer or crash, making it impossible to enjoy any content. Despite paying a premium for fiber optic internet, the performance is not meeting expectations.",1
3424-NMNBO,"When I reached out for help regarding the streaming issues, I was told that tech support is not included in my plan. Given how long I've been a customer and the amount I pay monthly, this lack of support is unacceptable.",2
2070-FNEXE,"The internet service has been unreliable, with frequent outages and slow speeds. This has been extremely frustrating, especially since I rely on it for important tasks.",1
2070-FNEXE,"When I reached out to customer support for assistance with the internet issues, I was told there was nothing they could do immediately. The lack of timely support has been very disappointing.",2
4547-KQRTM,"The internet service has been extremely unreliable, with frequent outages and slow speeds, making it impossible to complete my work or stream content. This has been a recurring issue for months, and it remains unresolved despite my complaints.",1
4547-KQRTM,"The customer support team has been unhelpful in resolving my internet issues. Every time I contact them, I am either put on hold for too long or given generic advice that doesn't fix the problem.",2
2026-TGDHM,"The streaming movies service often buffers and crashes, making it impossible to enjoy a movie. Despite paying a high monthly fee, the service doesn't meet my expectations.",1
3398-FSHON,"The internet speed on my fiber optic connection has been extremely disappointing, especially when streaming TV. It's frustrating to pay such high monthly charges and not get the quality I expect.",1
3398-FSHON,"I contacted customer support about the slow internet issue, but they were unhelpful and didn't provide any meaningful solutions. I felt like my concerns were ignored.",2
3398-FSHON,"I find the monthly charges of $91.3 to be excessive, especially since I don't have Online Security or Tech Support. I don't feel like I'm getting value for the money I'm paying.",3
8182-PNAGI,"The tech support service I signed up for has been unhelpful in resolving my ongoing internet connectivity issues. Despite multiple calls, the problem persists, and I feel like I'm not getting the assistance I'm paying for.",1
0419-YAAPX,"The streaming TV service frequently buffers and the picture quality often drops during peak hours, which is very frustrating considering the high monthly charges I am paying.",1
0014-BMAQU,"The internet speed has been inconsistent lately, which is frustrating as I rely on a stable connection for work. Despite having Fiber optic service, the performance does not match my expectations.",1
0014-BMAQU,"I recently contacted tech support for assistance with the connectivity issues, but the response was delayed, and the resolution provided did not fully address the problem.",2
0014-BMAQU,"Given my long tenure as a customer, I feel disappointed that these recurring issues have not been resolved, especially considering the high monthly charges I am paying.",3
5256-SKJGO,"The streaming services I signed up for, including TV and movies, often buffer and take too long to load, which is very frustrating considering the length of time I've been a loyal customer.",1
6661-HBGWL,"The streaming services I’m paying for, both TV and movies, constantly buffer or fail to load. This has been an ongoing issue despite my high monthly charges, and it's unacceptable.",1
6661-HBGWL,"The internet speeds with Fiber Optic are not as fast as advertised. I frequently experience slowdowns, especially during peak hours, which is frustrating.",2
6661-HBGWL,I’ve been paying for tech support but have never been able to reach a representative when I need assistance. It feels like I’m paying for a service I can’t even use.,3
6661-HBGWL,"The customer service team has been unhelpful in resolving my ongoing issues with internet and streaming. Every time I call, I’m put on hold for extended periods with no resolution.",4
6661-HBGWL,"Despite being a loyal customer for 42 months, I feel like my concerns are not being prioritized. The lack of support and poor service quality have made me decide to leave.",5
8512-WIWYV,"I'm frustrated that I can't bundle internet services with my account, as it seems like a missed opportunity to improve my overall experience.",1
8512-WIWYV,"Despite being a loyal customer for over two years, I don't feel like I'm receiving any incentives or rewards for staying.",2
8512-WIWYV,The lack of a paperless billing option feels outdated and inconvenient in a time when most companies offer this feature.,3
8512-WIWYV,I feel that the monthly charges for just phone service are relatively high compared to what competitors offer with bundled packages.,4
8512-WIWYV,"I recently had difficulty reaching customer support for a question about my bill, and the process was unnecessarily time-consuming.",5
3005-NFMTA,"The streaming services I signed up for, like StreamingTV and StreamingMovies, keep buffering and have poor quality. It's frustrating to pay for something that doesn't work properly.",1
3005-NFMTA,"Even though I have OnlineSecurity, I recently experienced a security breach, and it seems like no proactive measures were taken to prevent it.",2
3005-NFMTA,"The Fiber optic internet is supposed to be fast, but I've been dealing with frequent outages, which disrupt my work and personal activities.",3
3005-NFMTA,"I tried to contact customer support about these issues, but there was no tech support available to assist me, and I was redirected multiple times without resolution.",4
3005-NFMTA,"Despite these ongoing problems, my monthly bill remains high at $98.8, and I feel like I'm not getting the value for the services I'm paying for.",5
1113-IUJYX,"The fiber optic internet service has been consistently unreliable, with frequent outages and slow speeds, making it difficult to stream TV and movies or work online effectively. Despite having tech support, the issue has not been resolved even after multiple calls.",1
